{
  "$schema": "https://json-schema.org/draft-07/schema#",
  "$id": "curated-article",
  "type": "object",
  "required": ["id", "title", "url", "source", "type", "tags", "submitted_at"],
  "properties": {
    "id": { "type": "string" },
    "title": { "type": "string", "maxLength": 200 },
    "url": { "type": "string", "format": "uri" },
    "source": { "type": "string" },
    "type": { "type": "string", "enum": ["article", "youtube", "x_thread", "threads", "other"] },
    "thumbnail_url": { "type": "string", "format": "uri" },
    "description": { "type": "string", "maxLength": 1000 },
    "tags": { "type": "array", "items": { "type": "string" }, "minItems": 1, "maxItems": 5 },
    "submitted_by": { "type": "string" },
    "submitted_at": { "type": "string" },
    "status": { "type": "string", "enum": ["pending", "approved", "rejected"] }
  },
  "additionalProperties": false
}
