{
  "id": "cms-test-article",
  "title": "[테스트] Decap CMS 승인 워크플로우 테스트 기사",
  "url": "https://example.com/test-article",
  "source": "HoneyCombo 내부 테스트",
  "type": "article",
  "description": "Decap CMS의 기사 검토 및 승인 기능이 정상 동작하는지 확인하기 위한 테스트 기사입니다. 승인 후 삭제 예정.",
  "tags": ["test", "cms"],
  "submitted_by": "sisyphus-agent",
  "submitted_at": "2026-04-13T20:00:00.000Z",
  "status": "pending"
}
